{
  "print_id": "2026-10-01",
  "basket_version": "SIU-2026a",
  "methodology_version": "v0-draft",
  "run_records": [
    "0072d272-cce8-49e3-9231-c24782c65df6.json",
    "00901c27-4947-437c-8b91-8e2f511f926f.json",
    "00d126a9-fb61-4bb2-bd36-688d65d7dc3a.json",
    "030113b3-95af-482c-af45-c67be508ed7f.json",
    "04cff4cd-26fd-4353-aee7-bb119afb4862.json",
    "084d9328-0059-4055-9bf5-b615caa84801.json",
    "0b853f58-e676-4b31-9c77-63c26cacaabc.json",
    "0db8b8c2-31ec-4d62-bc72-7eba4648c175.json",
    "0e80deb2-ecc6-4b3d-8885-c8b0ddf7b224.json",
    "0f0ccbf6-1068-490f-82d1-d8b66f42a28d.json",
    "0f48434e-7d6e-49c7-a29b-a4b5d1346e4e.json",
    "1445ae4e-cd23-41bf-b4ed-f8ab0f041150.json",
    "14b299ef-bd55-4b56-85be-1b3cb1e9f30c.json",
    "157f34c6-9921-425c-9d36-d86609ad074b.json",
    "1693c777-f4fa-49d6-97ad-4a7bdf5fda33.json",
    "179c6fb9-9be2-4846-a45a-8fefdc300f96.json",
    "186ecede-8d65-4596-94fd-6ab359b53f94.json",
    "1d03a802-365c-4b46-a8c6-9ff12954956e.json",
    "21946f5f-b07e-4c8a-bacc-6aaed4361505.json",
    "238f2500-f8cb-42ca-92ea-a3250c791bfe.json",
    "2859dbe6-8476-4763-a8a2-fa06722ffe4d.json",
    "29367036-e803-41c0-b051-e4cb7c5add55.json",
    "2a1cc60c-7e13-4990-bf1c-084866c326d8.json",
    "2b38a415-08ad-4c8c-9891-ee1dea4d8b02.json",
    "31a28e15-a4af-4943-a15f-c877337feaa1.json",
    "339bab3f-ca99-4f32-92bf-04c377eca225.json",
    "345fa64c-4d30-43a1-aec4-46643910e4cf.json",
    "35d2f11e-66db-4809-96a8-2462e57e15ea.json",
    "35d5bb85-0172-44c2-b11d-6e9ed1362442.json",
    "39fb0268-561a-45ea-9023-386b6e1fe50a.json",
    "3a05027a-73ca-461b-8753-fa92e49cfdde.json",
    "4309753e-5b8f-4af8-b696-963a26813681.json",
    "4319915f-5163-445e-89d2-aa0a8e44832b.json",
    "437ecf97-a099-45d1-8771-8d217dec5fb2.json",
    "45221064-ee07-4358-994f-5e26408b5aa5.json",
    "4678eb04-af68-4f51-adb8-d1878242645d.json",
    "4c06d1ee-2cdc-4697-864a-b7cf58fe563b.json",
    "4c7edb5c-6315-4e22-9167-3efb10fae3df.json",
    "4cd8570c-e41d-4a16-adca-b637a4052a16.json",
    "4ce7d5dd-c826-44a0-aabb-224a7d9d5f33.json",
    "4df94e13-6b4f-414f-adeb-e8e25f6bec18.json",
    "52292327-38a8-4478-86a8-e837e752f6b2.json",
    "52b2898c-3061-488b-9305-9ddecff95dbc.json",
    "537e34f2-0460-483e-bcf5-05562868caca.json",
    "53e5069e-5f93-4941-8dac-9ed841f7306d.json",
    "54567240-18de-4adf-8a52-33e616613bc1.json",
    "55cab759-b393-40c9-8661-12bfa4c9cf43.json",
    "56db78ed-5e4f-425b-aa55-dda534a4e69d.json",
    "58fbfd87-f9dc-4318-9f32-37b4b37df96d.json",
    "5dbb4304-bf12-44d8-8e4d-cbe6456c95e6.json",
    "5eaa7c48-35e0-4663-b17a-a91927a39c83.json",
    "600fac61-fb36-4469-8410-1606ab27cafd.json",
    "627bd9c4-7977-4c5c-b20d-f06dbc13e505.json",
    "62dc12f2-a215-4976-b7e1-6234c9a380f8.json",
    "63d430c8-1d63-44b3-9354-3efac085899b.json",
    "64d3f725-a4dd-4172-84a4-40ec6ba355c0.json",
    "658a5ba2-c540-4d9d-8a60-65d3de590965.json",
    "65beb2b1-5554-4fad-b8d2-af6946198579.json",
    "67587144-5256-4138-963f-a8542bdada18.json",
    "6766836e-444e-4be6-9804-269a36ddd871.json",
    "69c02a79-0716-4b48-af6e-f7eeed613861.json",
    "6b36f49b-41d6-489f-a0c1-7d930ff2ffef.json",
    "6b653d96-9506-4b5b-85da-0a4287fda1c5.json",
    "6cd0b157-e3ac-4043-bf60-52ba8f95863f.json",
    "6d66a643-bd17-4ae0-bf2d-1ebed7931a23.json",
    "706c3cc6-b88e-49ff-9316-662fa5ddb815.json",
    "72d92a6e-25a7-4540-8b85-e806597843dc.json",
    "767caf27-51b2-4466-a9f8-6c5ca50b5bde.json",
    "7e5b27c8-2739-4f67-bb2e-f70e4f8957e9.json",
    "7f736f15-f6be-49d9-816a-252bedf0c1c9.json",
    "7fd44390-bd23-4cd0-9b26-09f99770e055.json",
    "83b1fdd7-b6a8-4d21-a869-071d4d0ed985.json",
    "870bb9cb-88e5-401c-8bd7-501ca538442a.json",
    "89a2cd9c-6caf-447c-9f5a-7e1adca6a4e0.json",
    "8a8c92b1-5a09-4f3b-bb40-374fbb62a25d.json",
    "8bf37291-a762-401a-a786-1e2fce64d599.json",
    "8ee32f6a-3d16-4e35-b3f5-569759ff828b.json",
    "8f0179ea-6768-4016-8171-26782ffb1eac.json",
    "916c5847-f481-4b7a-aac0-073139f536cc.json",
    "919b2892-d463-4d9f-9786-26992ff0aeee.json",
    "934e8765-df4e-4ca6-bf70-593e9cef1970.json",
    "9a917d5a-2d3c-45bb-8c4f-e8f7c2741716.json",
    "9b5b7562-e8d9-49d9-b5bb-829246ddb50a.json",
    "9c3f6394-da1b-47cf-92b8-669fe43b9156.json",
    "9f1d4e4a-de63-4b62-b0b4-fa81e60ed9ee.json",
    "9f3e3d8a-f50d-431e-acef-98ee2ee14d49.json",
    "9f6d1615-333f-4877-b36d-abdd87dd8ff3.json",
    "9f9d9af8-835f-42d1-b8f0-c13807f948a0.json",
    "9fc0b901-14e1-4afa-88ce-58926704b5b2.json",
    "a16a2370-edc6-49ad-a194-809ccd15092e.json",
    "a1c77bbc-5049-4ff1-a332-156102865427.json",
    "a3740512-c544-4248-926b-0ba9aab8bc5d.json",
    "a4f92776-df47-438b-8bc8-e93d1b58aee9.json",
    "a569f54b-6606-4f15-b7aa-10d0fefd2119.json",
    "a619f966-9d24-4c7e-b81b-32c815df6d72.json",
    "a7ebbc1d-fc92-4ed2-aa1b-7edfbd9b7b6f.json",
    "a8095249-8c7c-4297-9c63-bd00595ac00a.json",
    "aa35f9d2-1f8b-473d-a728-528b57b18f49.json",
    "aae7e402-d7a6-43e1-afdd-335cbc650a3b.json",
    "af8a92f9-c908-484f-8d23-6aa75e7fd0ef.json",
    "b02e57a1-7fc1-4d1e-aad4-e2c36c9b2806.json",
    "b07ce7c4-b363-432c-9a59-78b66df814ea.json",
    "b0e3ee3a-90dc-4fb7-9186-cb5e2f901e74.json",
    "b552b04e-bfd6-47ac-a929-d324c33863ca.json",
    "b5fdfb70-635d-4bd5-b397-d49f78f32b12.json",
    "b7c2f65e-6441-45e3-a748-3544ce33db17.json",
    "b89341fe-f09a-458c-8412-36ddb96d1f56.json",
    "ba26df46-32df-4e76-af06-2ccf555e0b53.json",
    "ba7fd249-883f-4b6f-a0b7-ead42ed203d7.json",
    "bab2426e-9832-4099-9b37-b11b1c9de805.json",
    "baea756c-8a29-4d31-9bb9-8fd60137996f.json",
    "bc1648d8-2350-4460-846c-469a0e193d48.json",
    "bced2485-966d-46f8-bfaa-eb05a9d2bb88.json",
    "be51e97d-1eeb-44f1-aaab-92c44c979a30.json",
    "be9d1c3d-4caa-493e-9f44-eb917ab349d6.json",
    "bef54b45-14e4-48c8-8ea0-d0d680b79522.json",
    "bf2de53c-0986-4449-9a66-5811813f7a76.json",
    "c2525381-79ae-45aa-a05a-7b04ac99c828.json",
    "c74ba162-4b4d-4ada-9fdf-a360a11e4268.json",
    "c88a78cd-0dff-4b6c-8d30-86c2680a0480.json",
    "d58e850d-b1a9-48d2-8c17-47a1d8221691.json",
    "d66fa36d-af45-4fe8-9999-697edc4ac3bd.json",
    "d7518f0b-3f14-4e89-8887-263bd9405bf9.json",
    "da3f35ad-c9fb-4018-b51b-57b5cf1a8899.json",
    "db29f97f-5493-4ad5-9558-1f8100461137.json",
    "dbc684ab-3cda-4375-ae75-857595b3c53b.json",
    "dc0dde9e-b8ae-4ac3-ade8-7703d87ec7f5.json",
    "dccacafa-db25-43b9-82cc-bb94186c94e8.json",
    "df094b0e-0d16-4738-9203-8d1f63f85533.json",
    "dfad61bb-b16e-47b2-a259-aec7fab86b6c.json",
    "e3f2c184-1d76-4b07-b61a-b717ba208ed7.json",
    "e6388c4b-6057-4575-aed5-a4b4aaed83ed.json",
    "e6539170-61ce-4b84-8d17-4905f70912bb.json",
    "e96b27c3-36f6-4df0-b758-625d2c76d7ac.json",
    "e9ee1281-630b-40b1-80ea-abd79cef0807.json",
    "ea6aa182-7086-46c6-93d4-ce93e7830523.json",
    "eb5e2797-d207-48e6-be3d-1b9dec6453b5.json",
    "ecea4d78-47a6-4c38-b6a1-1bb6848e9e65.json",
    "ee792051-75c5-4a5e-a14b-e6162fca15b0.json",
    "eec3e16a-0f8d-4cd2-a5c4-70daa12f683d.json",
    "f109ac5c-2bb0-41da-b374-57c659386326.json",
    "f1cb5055-b3f4-49c0-bcfb-b36ce346d7ee.json",
    "f283a17d-80f5-47df-8184-d95ae65be92e.json",
    "f2d6d9ba-fab4-4376-9a63-02c2fc9d156a.json",
    "f44d8ed7-f3c7-452e-bd44-116d04df67eb.json",
    "f5ea3a6c-7ae7-469a-b7fa-fda45068245b.json",
    "f7076bc4-1897-4ef2-9e62-572e34f818c9.json",
    "f7c368eb-2edc-4856-b180-905ed807abdf.json",
    "f821eeab-ee7f-4763-91cc-b90e148e2d50.json",
    "fb23682d-18b0-4f45-abb7-e5679d845459.json",
    "fb5114b4-a63e-4513-bc06-ee3178cb00b7.json"
  ]
}
